[
  {
    "id": "grey-knights",
    "name": "Grey Knights",
    "parent_faction_id": null,
    "game_version": {
      "edition": "11th",
      "dataslate": "pre-launch-provisional"
    },
    "keywords": [
      "Imperium",
      "Adeptus Astartes",
      "Grey Knights"
    ],
    "aliases": [],
    "faction_rule_id": "gate-of-infinity",
    "logo_url": "https://cdn.jsdelivr.net/gh/Certseeds/wh40k-icon@be230023ff0755d19ffb1a1762658c711c2887f9/src/svgs/human_imperium/astartes_chapters/grey-knights.svg",
    "external_refs": [
      {
        "namespace": "game-datacards",
        "id": "93423323-3abb-4a72-a51e-b8ac54f2f98d"
      },
      {
        "namespace": "mfm",
        "id": "93423323-3abb-4a72-a51e-b8ac54f2f98d"
      }
    ]
  }
]
