[
  {
    "id": "adeptus-mechanicus",
    "name": "Adeptus Mechanicus",
    "parent_faction_id": null,
    "game_version": {
      "edition": "11th",
      "dataslate": "pre-launch-provisional"
    },
    "keywords": [
      "Imperium",
      "Adeptus Mechanicus"
    ],
    "aliases": [],
    "faction_rule_id": "doctrina-imperatives",
    "logo_url": "https://cdn.jsdelivr.net/gh/Certseeds/wh40k-icon@be230023ff0755d19ffb1a1762658c711c2887f9/src/svgs/human_imperium/adeptus-mechanicus.svg",
    "external_refs": [
      {
        "namespace": "game-datacards",
        "id": "AdM"
      },
      {
        "namespace": "mfm",
        "id": "60ecf26b-0c2b-4ea3-8a29-5f06bd02f6d8"
      }
    ]
  }
]
