[
  {
    "id": "ultramarines",
    "name": "Ultramarines",
    "parent_faction_id": "adeptus-astartes",
    "game_version": {
      "edition": "11th",
      "dataslate": "pre-launch-provisional"
    },
    "keywords": [
      "Imperium",
      "Adeptus Astartes",
      "Ultramarines"
    ],
    "aliases": [],
    "faction_rule_id": "oath-of-moment",
    "logo_url": "https://cdn.jsdelivr.net/gh/Certseeds/wh40k-icon@be230023ff0755d19ffb1a1762658c711c2887f9/src/svgs/human_imperium/astartes_legion/ultramarines.svg",
    "external_refs": [
      {
        "namespace": "mfm",
        "id": "b7d67027-cf56-4cd1-8127-9e7658de4ef5"
      }
    ]
  }
]
