[
  {
    "id": "blood-angels",
    "name": "Blood Angels",
    "parent_faction_id": "adeptus-astartes",
    "game_version": {
      "edition": "11th",
      "dataslate": "pre-launch-provisional"
    },
    "keywords": [
      "Imperium",
      "Adeptus Astartes",
      "Blood Angels"
    ],
    "aliases": [],
    "faction_rule_id": "oath-of-moment",
    "logo_url": "https://cdn.jsdelivr.net/gh/Certseeds/wh40k-icon@be230023ff0755d19ffb1a1762658c711c2887f9/src/svgs/human_imperium/astartes_legion/blood-angels.svg",
    "external_refs": [
      {
        "namespace": "game-datacards",
        "id": "CHBA"
      },
      {
        "namespace": "mfm",
        "id": "864734c9-d6c7-4486-92de-9b8271a6a1e5"
      }
    ]
  }
]
