[
  {
    "id": "genestealer-cults",
    "name": "Genestealer Cults",
    "parent_faction_id": null,
    "game_version": {
      "edition": "11th",
      "dataslate": "pre-launch-provisional"
    },
    "keywords": [
      "Genestealer Cults"
    ],
    "aliases": [],
    "faction_rule_id": "cult-ambush",
    "logo_url": "https://cdn.jsdelivr.net/gh/Certseeds/wh40k-icon@be230023ff0755d19ffb1a1762658c711c2887f9/src/svgs/xenos/genestealer_cult/genestealer-cults.svg",
    "external_refs": [
      {
        "namespace": "game-datacards",
        "id": "GSC"
      },
      {
        "namespace": "mfm",
        "id": "800c0387-5033-47da-bad0-f42e53b37453"
      }
    ]
  }
]
