[
  {
    "id": "space-wolves",
    "name": "Space Wolves",
    "parent_faction_id": "adeptus-astartes",
    "game_version": {
      "edition": "11th",
      "dataslate": "pre-launch-provisional"
    },
    "keywords": [
      "Imperium",
      "Adeptus Astartes",
      "Space Wolves"
    ],
    "aliases": [],
    "faction_rule_id": "oath-of-moment",
    "logo_url": "https://cdn.jsdelivr.net/gh/Certseeds/wh40k-icon@be230023ff0755d19ffb1a1762658c711c2887f9/src/svgs/human_imperium/astartes_legion/space-wolves.svg",
    "external_refs": [
      {
        "namespace": "game-datacards",
        "id": "CHSW"
      },
      {
        "namespace": "mfm",
        "id": "bc367514-36b7-47c6-bd3f-ffbf85f5cfd9"
      }
    ]
  }
]
