[
  {
    "id": "chaos-daemons",
    "name": "Chaos Daemons",
    "parent_faction_id": null,
    "game_version": {
      "edition": "11th",
      "dataslate": "pre-launch-provisional"
    },
    "keywords": [
      "Chaos",
      "Daemons",
      "Legiones Daemonica"
    ],
    "aliases": [],
    "faction_rule_id": "the-shadow-of-chaos",
    "logo_url": "https://cdn.jsdelivr.net/gh/Certseeds/wh40k-icon@be230023ff0755d19ffb1a1762658c711c2887f9/src/svgs/chaos/chaos-daemons.svg",
    "external_refs": [
      {
        "namespace": "game-datacards",
        "id": "CD"
      }
    ]
  }
]
