[
  {
    "id": "adepta-sororitas",
    "name": "Adepta Sororitas",
    "parent_faction_id": null,
    "game_version": {
      "edition": "11th",
      "dataslate": "pre-launch-provisional"
    },
    "keywords": [
      "Imperium",
      "Adepta Sororitas"
    ],
    "aliases": [],
    "faction_rule_id": "acts-of-faith",
    "logo_url": "https://cdn.jsdelivr.net/gh/Certseeds/wh40k-icon@be230023ff0755d19ffb1a1762658c711c2887f9/src/svgs/human_imperium/adepta-sororitas.svg",
    "external_refs": [
      {
        "namespace": "game-datacards",
        "id": "AS"
      },
      {
        "namespace": "mfm",
        "id": "aee1b46d-3461-4d5d-a612-0efd05dd843d"
      }
    ]
  }
]
