[
  {
    "id": "chaos-knights",
    "name": "Chaos Knights",
    "parent_faction_id": null,
    "game_version": {
      "edition": "11th",
      "dataslate": "pre-launch-provisional"
    },
    "keywords": [
      "Chaos",
      "Chaos Knights"
    ],
    "aliases": [],
    "faction_rule_id": "harbingers-of-dread",
    "logo_url": "https://cdn.jsdelivr.net/gh/Certseeds/wh40k-icon@be230023ff0755d19ffb1a1762658c711c2887f9/src/svgs/chaos/questor-traitoris.svg",
    "external_refs": [
      {
        "namespace": "game-datacards",
        "id": "2e79f9cd-94dc-48ca-bddf-6d5e877609c5"
      },
      {
        "namespace": "mfm",
        "id": "2e79f9cd-94dc-48ca-bddf-6d5e877609c5"
      }
    ]
  }
]
