[
  {
    "id": "deathwatch",
    "name": "Deathwatch",
    "parent_faction_id": "adeptus-astartes",
    "game_version": {
      "edition": "11th",
      "dataslate": "pre-launch-provisional"
    },
    "keywords": [
      "Imperium",
      "Adeptus Astartes",
      "Deathwatch"
    ],
    "aliases": [],
    "faction_rule_id": "mission-tactics",
    "logo_url": "https://cdn.jsdelivr.net/gh/Certseeds/wh40k-icon@be230023ff0755d19ffb1a1762658c711c2887f9/src/svgs/human_imperium/astartes_chapters/deathwatch.svg",
    "external_refs": [
      {
        "namespace": "game-datacards",
        "id": "CHDW"
      },
      {
        "namespace": "mfm",
        "id": "51ac31b0-93ff-4c94-a9a5-5c1a97fbbb75"
      }
    ]
  }
]
